{
  "format": "paralleldoc",
  "version": "3.0",
  "metadata": {
    "document_id": "m-24",
    "revision": "rev-1",
    "title": "Forbidden Credentials URL",
    "author_refs": [
      "auth-m-01"
    ]
  },
  "authors": [
    {
      "id": "auth-m-01",
      "kind": "tool",
      "name": "Media Contract Tester"
    }
  ],
  "units": [
    {
      "id": "u-m-01",
      "kind": "source",
      "title": "Media Demonstration Clause",
      "text": "Clause referencing test raster assets.",
      "text_format": "plain",
      "author_refs": [
        "auth-m-01"
      ],
      "epistemic": "reported",
      "status": "reviewed",
      "source_refs": [],
      "asset_ids": [
        "ast-24"
      ],
      "provenance": {
        "label": "Media Spec v3"
      }
    }
  ],
  "groups": [
    {
      "id": "g-m-01",
      "title": "Media Test Group",
      "unit_refs": [
        "u-m-01"
      ]
    }
  ],
  "visuals": [],
  "assets": [
    {
      "id": "ast-24",
      "mime": "image/png",
      "sha256": "be8e02e888c1889a7c3de54f86c9740e63b97f9fb575f3cce702038d1900cfe8",
      "byte_length": 492,
      "width": 240,
      "height": 140,
      "alt": "URL with credentials",
      "caption": "Error Card 24",
      "author_refs": [
        "auth-m-01"
      ],
      "locator": {
        "mode": "external",
        "url": "https://admin:secretpass@cloud-storage.com/asset.png"
      },
      "provenance": {
        "label": "Media Spec v3"
      }
    }
  ],
  "profiles": []
}