{
  "format": "paralleldoc",
  "version": "3.0",
  "metadata": {
    "document_id": "m-03",
    "revision": "rev-1",
    "title": "Valid WebP VP8 Asset",
    "author_refs": [
      "auth-m-01"
    ]
  },
  "authors": [
    {
      "id": "auth-m-01",
      "kind": "tool",
      "name": "Media Contract Tester"
    }
  ],
  "units": [
    {
      "id": "u-m-01",
      "kind": "source",
      "title": "Media Demonstration Clause",
      "text": "Clause referencing test raster assets.",
      "text_format": "plain",
      "author_refs": [
        "auth-m-01"
      ],
      "epistemic": "reported",
      "status": "reviewed",
      "source_refs": [],
      "asset_ids": [
        "ast-03"
      ],
      "provenance": {
        "label": "Media Spec v3"
      }
    }
  ],
  "groups": [
    {
      "id": "g-m-01",
      "title": "Media Test Group",
      "unit_refs": [
        "u-m-01"
      ]
    }
  ],
  "visuals": [],
  "assets": [
    {
      "id": "ast-03",
      "mime": "image/webp",
      "sha256": "bfcd6738185581378f47708aa9f51d10b750b59d056142f1f5564483323fd8a8",
      "byte_length": 40,
      "width": 180,
      "height": 90,
      "alt": "Valid test WebP VP8 thumbnail",
      "caption": "Figure 3: Valid WebP VP8",
      "author_refs": [
        "auth-m-01"
      ],
      "locator": {
        "mode": "embedded",
        "data_uri": "data:image/webp;base64,UklGRh4AAABXRUJQVlA4IBIAAAAwAQCdASq0AFoAAAAAAAAAAAAAAA=="
      },
      "provenance": {
        "label": "Media Spec v3"
      }
    }
  ],
  "profiles": []
}