{
  "format": "paralleldoc",
  "version": "3.0",
  "metadata": {
    "document_id": "m-12",
    "revision": "rev-1",
    "title": "Unsupported GIF bytes",
    "author_refs": [
      "auth-m-01"
    ]
  },
  "authors": [
    {
      "id": "auth-m-01",
      "kind": "tool",
      "name": "Media Contract Tester"
    }
  ],
  "units": [
    {
      "id": "u-m-01",
      "kind": "source",
      "title": "Media Demonstration Clause",
      "text": "Clause referencing test raster assets.",
      "text_format": "plain",
      "author_refs": [
        "auth-m-01"
      ],
      "epistemic": "reported",
      "status": "reviewed",
      "source_refs": [],
      "asset_ids": [
        "ast-12"
      ],
      "provenance": {
        "label": "Media Spec v3"
      }
    }
  ],
  "groups": [
    {
      "id": "g-m-01",
      "title": "Media Test Group",
      "unit_refs": [
        "u-m-01"
      ]
    }
  ],
  "visuals": [],
  "assets": [
    {
      "id": "ast-12",
      "mime": "image/png",
      "sha256": "693d949d8c3fdc7fd4ace7c340b5f177a9f0c5be7bafee8bc93a7d88b7523d75",
      "byte_length": 43,
      "width": 1,
      "height": 1,
      "alt": "GIF89a payload declared as PNG",
      "caption": "Error Card 12",
      "author_refs": [
        "auth-m-01"
      ],
      "locator": {
        "mode": "embedded",
        "data_uri": "data:image/png;base64,R0lGODlhAQABAIAAAAAAAP///yH5BAEAAAAALAAAAAABAAEAAAICRAEAOw=="
      },
      "provenance": {
        "label": "Media Spec v3"
      }
    }
  ],
  "profiles": []
}