{
  "format": "paralleldoc",
  "version": "3.0",
  "metadata": {
    "document_id": "doc:2026.09-v3_01.corp-alpha:node-99",
    "revision": "rev.1.0_final-build:2026",
    "title": "Corpus V07 Document with Extreme Valid Identifiers",
    "author_refs": [
      "auth.lead-eng:primary_01"
    ]
  },
  "authors": [
    {
      "id": "auth.lead-eng:primary_01",
      "kind": "human",
      "name": "ID Syntax Tester"
    }
  ],
  "units": [
    {
      "id": "u-sla.core:metric_01-alpha",
      "kind": "source",
      "title": "Extreme ID Unit 1",
      "text": "Unit testing valid ID regex pattern.",
      "text_format": "plain",
      "author_refs": [
        "auth.lead-eng:primary_01"
      ],
      "epistemic": "reported",
      "status": "done",
      "source_refs": [],
      "asset_ids": [],
      "provenance": {
        "label": "Doc §1"
      }
    },
    {
      "id": "u-calc_02.risk:assessment_final",
      "kind": "analysis",
      "title": "Extreme ID Unit 2",
      "text": "Analysis unit with complex ID.",
      "text_format": "plain",
      "author_refs": [
        "auth.lead-eng:primary_01"
      ],
      "epistemic": "supported",
      "status": "reviewed",
      "source_refs": [
        "u-sla.core:metric_01-alpha"
      ],
      "asset_ids": []
    }
  ],
  "groups": [
    {
      "id": "g:infrastructure.compute:cluster-01",
      "title": "Extreme ID Group",
      "unit_refs": [
        "u-sla.core:metric_01-alpha",
        "u-calc_02.risk:assessment_final"
      ]
    }
  ],
  "visuals": [],
  "assets": [],
  "profiles": []
}