{
  "format": "paralleldoc",
  "version": "3.0",
  "metadata": {
    "document_id": "m-06",
    "revision": "rev-1",
    "title": "Extreme Aspect Ratios",
    "author_refs": [
      "auth-m-01"
    ]
  },
  "authors": [
    {
      "id": "auth-m-01",
      "kind": "tool",
      "name": "Media Contract Tester"
    }
  ],
  "units": [
    {
      "id": "u-m-01",
      "kind": "source",
      "title": "Media Demonstration Clause",
      "text": "Clause referencing test raster assets.",
      "text_format": "plain",
      "author_refs": [
        "auth-m-01"
      ],
      "epistemic": "reported",
      "status": "reviewed",
      "source_refs": [],
      "asset_ids": [
        "ast-06-wide",
        "ast-06-tall"
      ],
      "provenance": {
        "label": "Media Spec v3"
      }
    }
  ],
  "groups": [
    {
      "id": "g-m-01",
      "title": "Media Test Group",
      "unit_refs": [
        "u-m-01"
      ]
    }
  ],
  "visuals": [],
  "assets": [
    {
      "id": "ast-06-wide",
      "mime": "image/png",
      "sha256": "f5273915c4316963582bcdf843c1c60a76e34c106089734dfb6a0ecfd275c872",
      "byte_length": 1487,
      "width": 1200,
      "height": 200,
      "alt": "Ultra wide panoramic image",
      "caption": "Figure 6a: 6:1 wide",
      "author_refs": [
        "auth-m-01"
      ],
      "locator": {
        "mode": "embedded",
        "data_uri": "data:image/png;base64,iVBORw0KGgoAAAANSUhEUgAABLAAAADICAYAAAD4HxhwAAAFlklEQVR4nO3YIQEAIBDAQJKQmcZPAywTJ85Pb+0zAwAAAABV63cAAAAAALwYWAAAAACkGVgAAAAApBlYAAAAAKQZWAAAAACkGVgAAAAApBlYAAAAAKQZWAAAAACkGVgAAAAApBlYAAAAAKQZWAAAAACkGVgAAAAApBlYAAAAAKQZWAAAAACkGVgAAAAApBlYAAAAAKQZWAAAAACkGVgAAAAApBlYAAAAAKQZWAAAAACkGVgAAAAApBlYAAAAAKQZWAAAAACkGVgAAAAApBlYAAAAAKQZWAAAAACkGVgAAAAApBlYAAAAAKQZWAAAAACkGVgAAAAApBlYAAAAAKQZWAAAAACkGVgAAAAApBlYAAAAAKQZWAAAAACkGVgAAAAApBlYAAAAAKQZWAAAAACkGVgAAAAApBlYAAAAAKQZWAAAAACkGVgAAAAApBlYAAAAAKQZWAAAAACkGVgAAAAApBlYAAAAAKQZWAAAAACkGVgAAAAApBlYAAAAAKQZWAAAAACkGVgAAAAApBlYAAAAAKQZWAAAAACkGVgAAAAApBlYAAAAAKQZWAAAAACkGVgAAAAApBlYAAAAAKQZWAAAAACkGVgAAAAApBlYAAAAAKQZWAAAAACkGVgAAAAApBlYAAAAAKQZWAAAAACkGVgAAAAApBlYAAAAAKQZWAAAAACkGVgAAAAApBlYAAAAAKQZWAAAAACkGVgAAAAApBlYAAAAAKQZWAAAAACkGVgAAAAApBlYAAAAAKQZWAAAAACkGVgAAAAApBlYAAAAAKQZWAAAAACkGVgAAAAApBlYAAAAAKQZWAAAAACkGVgAAAAApBlYAAAAAKQZWAAAAACkGVgAAAAApBlYAAAAAKQZWAAAAACkGVgAAAAApBlYAAAAAKQZWAAAAACkGVgAAAAApBlYAAAAAKQZWAAAAACkGVgAAAAApBlYAAAAAKQZWAAAAACkGVgAAAAApBlYAAAAAKQZWAAAAACkGVgAAAAApBlYAAAAAKQZWAAAAACkGVgAAAAApBlYAAAAAKQZWAAAAACkGVgAAAAApBlYAAAAAKQZWAAAAACkGVgAAAAApBlYAAAAAKQZWAAAAACkGVgAAAAApBlYAAAAAKQZWAAAAACkGVgAAAAApBlYAAAAAKQZWAAAAACkGVgAAAAApBlYAAAAAKQZWAAAAACkGVgAAAAApBlYAAAAAKQZWAAAAACkGVgAAAAApBlYAAAAAKQZWAAAAACkGVgAAAAApBlYAAAAAKQZWAAAAACkGVgAAAAApBlYAAAAAKQZWAAAAACkGVgAAAAApBlYAAAAAKQZWAAAAACkGVgAAAAApBlYAAAAAKQZWAAAAACkGVgAAAAApBlYAAAAAKQZWAAAAACkGVgAAAAApBlYAAAAAKQZWAAAAACkGVgAAAAApBlYAAAAAKQZWAAAAACkGVgAAAAApBlYAAAAAKQZWAAAAACkGVgAAAAApBlYAAAAAKQZWAAAAACkGVgAAAAApBlYAAAAAKQZWAAAAACkGVgAAAAApBlYAAAAAKQZWAAAAACkGVgAAAAApBlYAAAAAKQZWAAAAACkGVgAAAAApBlYAAAAAKQZWAAAAACkGVgAAAAApBlYAAAAAKQZWAAAAACkGVgAAAAApBlYAAAAAKQZWAAAAACkGVgAAAAApBlYAAAAAKQZWAAAAACkGVgAAAAApBlYAAAAAKQZWAAAAACkGVgAAAAApBlYAAAAAKQZWAAAAACkGVgAAAAApBlYAAAAAKQZWAAAAACkGVgAAAAApBlYAAAAAKQZWAAAAACkGVgAAAAApBlYAAAAAKQZWAAAAACkGVgAAAAApBlYAAAAAKQZWAAAAACkGVgAAAAApBlYAAAAAKQZWAAAAACkGVgAAAAApBlYAAAAAKRdY6h0yIOmD/UAAAAASUVORK5CYII="
      },
      "provenance": {
        "label": "Media Spec v3"
      }
    },
    {
      "id": "ast-06-tall",
      "mime": "image/png",
      "sha256": "b62607e537bff029c6b856cb7b3bb25cf98856dac6613d819c5035407503a13b",
      "byte_length": 2090,
      "width": 200,
      "height": 800,
      "alt": "Tall portrait image",
      "caption": "Figure 6b: 1:4 portrait",
      "author_refs": [
        "auth-m-01"
      ],
      "locator": {
        "mode": "embedded",
        "data_uri": "data:image/png;base64,iVBORw0KGgoAAAANSUhEUgAAAMgAAAMgCAYAAABmpy3sAAAH8UlEQVR4nO3TIREAIADAQJKQmcZQgJsF8eL9zMZcewN343UA/MwgEAwCwSAQDALBIBAMAsEgEAwCwSAQDALBIBAMAsEgEAwCwSAQDALBIBAMAsEgEAwCwSAQDALBIBAMAsEgEAwCwSAQDALBIBAMAsEgEAwCwSAQDALBIBAMAsEgEAwCwSAQDALBIBAMAsEgEAwCwSAQDALBIBAMAsEgEAwCwSAQDALBIBAMAsEgEAwCwSAQDALBIBAMAsEgEAwCwSAQDALBIBAMAsEgEAwCwSAQDALBIBAMAsEgEAwCwSAQDALBIBAMAsEgEAwCwSAQDALBIBAMAsEgEAwCwSAQDALBIBAMAsEgEAwCwSAQDALBIBAMAsEgEAwCwSAQDALBIBAMAsEgEAwCwSAQDALBIBAMAsEgEAwCwSAQDALBIBAMAsEgEAwCwSAQDALBIBAMAsEgEAwCwSAQDALBIBAMAsEgEAwCwSAQDALBIBAMAsEgEAwCwSAQDALBIBAMAsEgEAwCwSAQDALBIBAMAsEgEAwCwSAQDALBIBAMAsEgEAwCwSAQDALBIBAMAsEgEAwCwSAQDALBIBAMAsEgEAwCwSAQDALBIBAMAsEgEAwCwSAQDALBIBAMAsEgEAwCwSAQDALBIBAMAsEgEAwCwSAQDALBIBAMAsEgEAwCwSAQDALBIBAMAsEgEAwCwSAQDALBIBAMAsEgEAwCwSAQDALBIBAMAsEgEAwCwSAQDALBIBAMAsEgEAwCwSAQDALBIBAMAsEgEAwCwSAQDALBIBAMAsEgEAwCwSAQDALBIBAMAsEgEAwCwSAQDALBIBAMAsEgEAwCwSAQDALBIBAMAsEgEAwCwSAQDALBIBAMAsEgEAwCwSAQDALBIBAMAsEgEAwCwSAQDALBIBAMAsEgEAwCwSAQDALBIBAMAsEgEAwCwSAQDALBIBAMAsEgEAwCwSAQDALBIBAMAsEgEAwCwSAQDALBIBAMAsEgEAwCwSAQDALBIBAMAsEgEAwCwSAQDALBIBAMAsEgEAwCwSAQDALBIBAMAsEgEAwCwSAQDALBIBAMAsEgEAwCwSAQDALBIBAMAsEgEAwCwSAQDALBIBAMAsEgEAwCwSAQDALBIBAMAsEgEAwCwSAQDALBIBAMAsEgEAwCwSAQDALBIBAMAsEgEAwCwSAQDALBIBAMAsEgEAwCwSAQDALBIBAMAsEgEAwCwSAQDALBIBAMAsEgEAwCwSAQDALBIBAMAsEgEAwCwSAQDALBIBAMAsEgEAwCwSAQDALBIBAMAsEgEAwCwSAQDALBIBAMAsEgEAwCwSAQDALBIBAMAsEgEAwCwSAQDALBIBAMAsEgEAwCwSAQDALBIBAMAsEgEAwCwSAQDALBIBAMAsEgEAwCwSAQDALBIBAMAsEgEAwCwSAQDALBIBAMAsEgEAwCwSAQDALBIBAMAsEgEAwCwSAQDALBIBAMAsEgEAwCwSAQDALBIBAMAsEgEAwCwSAQDALBIBAMAsEgEAwCwSAQDALBIBAMAsEgEAwCwSAQDALBIBAMAsEgEAwCwSAQDALBIBAMAsEgEAwCwSAQDALBIBAMAsEgEAwCwSAQDALBIBAMAsEgEAwCwSAQDALBIBAMAsEgEAwCwSAQDALBIBAMAsEgEAwCwSAQDALBIBAMAsEgEAwCwSAQDALBIBAMAsEgEAwCwSAQDALBIBAMAsEgEAwCwSAQDALBIBAMAsEgEAwCwSAQDALBIBAMAsEgEAwCwSAQDALBIBAMAsEgEAwCwSAQDALBIBAMAsEgEAwCwSAQDALBIBAMAsEgEAwCwSAQDALBIBAMAsEgEAwCwSAQDALBIBAMAsEgEAwCwSAQDALBIBAMAsEgEAwCwSAQDALBIBAMAsEgEAwCwSAQDALBIBAMAsEgEAwCwSAQDALBIBAMAsEgEAwCwSAQDALBIBAMAsEgEAwCwSAQDALBIBAMAsEgEAwCwSAQDALBIBAMAsEgEAwCwSAQDALBIBAMAsEgEAwCwSAQDALBIBAMAsEgEAwCwSAQDALBIBAMAsEgEAwCwSAQDALBIBAMAsEgEAwCwSAQDALBIBAMAsEgEAwCwSAQDALBIBAMAsEgEAwCwSAQDALBIBAMAsEgEAwCwSAQDALBIBAMAsEgEAwCwSAQDALBIBAMAsEgEAwCwSAQDALBIBAMAsEgEAwCwSAQDALBIBAMAsEgEAwCwSAQDALBIBAMAsEgEAwCwSAQDALBIBAMAsEgEAwCwSAQDALBIBAMAsEgEAwCwSAQDALBIBAMAsEgEAwCwSAQDALBIBAMAsEgEAwCwSAQDALBIBAMAsEgEAwCwSAQDALBIBAMAsEgEAwCwSAQDALBIBAMAsEgEAwCwSAQDALBIBAMAsEgEAwCwSAQDALBIBAMAsEgEAwCwSAQDALBIBAMAsEgEAwCwSAQDALBIBAMAsEgEAwCwSAQDALBIBAMAsEgEAwCwSAQDALBIBAMAsEgEAwCwSAQDALBIBAMAsEgEAwCwSAQDALBIBAMAsEgEAwCwSAQDALBIBAMAsEgEAwCwSAQDALBIBAMAsEgEAwCwSAQDALBIBAMAsEgEAwCwSAQDALBIBAMAsEgEAwCwSAQDALBIBAMAsEgEAwCwSAQDALBIBAMAsEgEAwCwSAQDALBIBAMAsEgEAwCwSAQDALBIBAMAsEgEAwCwSAQDALBIBAMAuEAfYRN2xVYFfoAAAAASUVORK5CYII="
      },
      "provenance": {
        "label": "Media Spec v3"
      }
    }
  ],
  "profiles": []
}