{
  "format": "paralleldoc",
  "version": "3.0",
  "metadata": {
    "document_id": "m-02",
    "revision": "rev-1",
    "title": "Valid JPEG Asset",
    "author_refs": [
      "auth-m-01"
    ]
  },
  "authors": [
    {
      "id": "auth-m-01",
      "kind": "tool",
      "name": "Media Contract Tester"
    }
  ],
  "units": [
    {
      "id": "u-m-01",
      "kind": "source",
      "title": "Media Demonstration Clause",
      "text": "Clause referencing test raster assets.",
      "text_format": "plain",
      "author_refs": [
        "auth-m-01"
      ],
      "epistemic": "reported",
      "status": "reviewed",
      "source_refs": [],
      "asset_ids": [
        "ast-02"
      ],
      "provenance": {
        "label": "Media Spec v3"
      }
    }
  ],
  "groups": [
    {
      "id": "g-m-01",
      "title": "Media Test Group",
      "unit_refs": [
        "u-m-01"
      ]
    }
  ],
  "visuals": [],
  "assets": [
    {
      "id": "ast-02",
      "mime": "image/jpeg",
      "sha256": "0367ca1270adb333aa05e7960ad12e4a6ce6ccf0798e25e5495b29820e2b3f80",
      "byte_length": 35,
      "width": 160,
      "height": 100,
      "alt": "Valid test JPEG thumbnail",
      "caption": "Figure 2: Valid JPEG",
      "author_refs": [
        "auth-m-01"
      ],
      "locator": {
        "mode": "embedded",
        "data_uri": "data:image/jpeg;base64,/9j/4AAQSkZJRgABAQEASABIAAD/wAALCABkAKABAREA/9k="
      },
      "provenance": {
        "label": "Media Spec v3"
      }
    }
  ],
  "profiles": []
}